{
  "batch_id": "nrw-bergisch-aachen-2026-08",
  "region_scope": [
    "Bergisches Land",
    "Staedteregion Aachen",
    "Kreis Heinsberg",
    "Kreis Dueren"
  ],
  "search_terms": [
    "Wuppertal Solingen Remscheid Velbert Kirmes Weihnachtsmarkt Bewerbung Schausteller Frist Stadt",
    "Aachen Eschweiler Stolberg Alsdorf Wuerselen Juelich Kirmes Bewerbung Schausteller Frist Ordnungsamt"
  ],
  "max_expected_results": 40,
  "source_policy": "official_only",
  "researched_at": "2026-08-04",
  "entries": [],
  "rejected_candidates": [],
  "review_candidates": [
    {
      "event_name": "Weihnachtsmaerkte Wuppertal-Elberfeld und Wuppertal-Barmen 2027",
      "candidate_url": "https://sv-wuppertal.de/",
      "reason": "Die Stadt Wuppertal hat den Betrieb der grossen Weihnachtsmaerkte fuer die Jahre 2025 bis 2029 an den Schausteller-Verein Wuppertal uebertragen. Vierter dokumentierter Fall einer Mehrjahresvergabe nach Maschseefest Hannover, Kieler Woche und Wackersdorf. Bewerbungen laufen damit ueber den Verein, nicht ueber die Stadt; ein Verfahren mit Frist ist auf der Vereinsseite nicht veroeffentlicht."
    },
    {
      "event_name": "Osterkirmes und Megakirmes Wuppertal 2027",
      "candidate_url": "https://sv-wuppertal.de/",
      "reason": "Die Osterkirmes eroeffnet die Wuppertaler Kirmessaison, 2026 vom 20. bis 23. Maerz auf dem Berliner Platz; dazu kommt die zehntaegige Megakirmes am Zoo/Stadion. Traeger ist der Schausteller-Verein Wuppertal. Kein Bewerbungsverfahren mit Frist veroeffentlicht."
    },
    {
      "event_name": "Kirmessen der Staedteregion Aachen (Eschweiler, Stolberg, Alsdorf, Wuerselen, Aachen)",
      "candidate_url": "https://www.schausteller.de/verbaende/49/",
      "reason": "Strukturhinweis: In der Staedteregion Aachen haben Schausteller die Organisation selbst uebernommen. Gegruendet wurde dafuer die Schaustellerdienste der Staedteregion Aachen (SDSA); die Eschweiler Sommerkirmes kehrte so nach rund 30 Jahren in die Innenstadt zurueck. Ansprechpartner ist der Schausteller-Verband Aachen e. V., nicht das jeweilige Ordnungsamt. Kein Verfahren mit Frist veroeffentlicht."
    },
    {
      "event_name": "Sommerkirmes Juelich",
      "candidate_url": "https://aachenerkinder.de/veranstaltung/sommerkirmes-in-der-stadt-juelich/",
      "reason": "Kirmes auf dem Schlossplatz im Stadtzentrum mit Fahrgeschaeften, Spiel- und Imbissstaenden. Eine offizielle Stadtseite mit Bewerbungsverfahren und Frist konnte nicht gefunden werden."
    },
    {
      "event_name": "Kirmessen Solingen, Remscheid, Velbert, Schwelm, Ennepetal",
      "candidate_url": "https://www.solingen.de/",
      "reason": "Fuenf Staedte des Bergischen Landes geprueft. Die Remscheider Maikirmes wird vom Remscheider Schuetzenverein von 1816 ausgerichtet und ist bereits als Kandidat erfasst; die Gevelsberger Kirmes ist als Eintrag vorhanden. Fuer die uebrigen Staedte liess sich kein Bewerbungsverfahren mit Frist finden."
    },
    {
      "event_name": "Kirmessen Kreis Heinsberg (Heinsberg, Erkelenz, Geilenkirchen)",
      "candidate_url": "https://www.heinsberg.de/",
      "reason": "Drei Staedte geprueft. Der Erkelenzer Lambertusmarkt ist terminlich belegt, ein Bewerbungsverfahren mit Frist ist nicht veroeffentlicht. Hueckelhoven im selben Kreis ist bereits als Kandidat erfasst (sechs Ortsteil-Kirmessen, Bewerbung 'rechtzeitig' ohne Datum)."
    },
    {
      "event_name": "Annakirmes Dueren 2028",
      "candidate_url": "https://www.dueren.de/kultur-tourismus/veranstaltungen/annakirmes/schausteller",
      "reason": "Der Jahrgang 2027 ist mit Frist 30.09.2026 bereits als Eintrag erfasst. Fuer 2028 waere nach demselben Muster der 30.09.2027 anzusetzen; die Stadt weist die Frist jedoch nicht ausdruecklich als Dauerregel aus, daher zunaechst nur vorgemerkt."
    }
  ]
}
