{
  "batch_id": "by-unterfranken-oberpfalz-2026-09",
  "region_scope": ["Bayern"],
  "search_terms": [
    "Bad Kissingen Schausteller Rakoczyfest Bewerbung Frist",
    "Hassfurt Schausteller Volksfest Bewerbung Frist Marktamt",
    "Kitzingen Schausteller Volksfest Bewerbung Frist",
    "Miltenberg Schausteller Michaelismesse Bewerbung Frist",
    "Amberg Schausteller Volksfest Bewerbung Frist Ordnungsamt",
    "Schwandorf Schausteller Volksfest Bewerbung Frist",
    "Cham Oberpfalz Schausteller Volksfest Bewerbung Frist",
    "Sulzbach-Rosenberg Schausteller Volksfest Bewerbung Frist",
    "Tirschenreuth Schausteller Volksfest Bewerbung Frist"
  ],
  "max_expected_results": 20,
  "source_policy": "official_only",
  "researched_at": "2026-09-16",
  "entries": [
    {
      "id": "michaelismesse-2027-miltenberg",
      "event_name": "Michaelismesse Miltenberg 2027",
      "event_type": "Volksfest",
      "city": "Miltenberg",
      "state": "Bayern",
      "country": "DE",
      "venue_or_area": "Festplatz Michaelismesse, Miltenberg",
      "application_deadline_iso": "2027-01-31",
      "application_deadline_text": "Vergnuegungspark: Bewerbung bis spaetestens 15.09.2026. Marktgelaende, Ausstellungshalle und Ausstellungsgelaende: Bewerbungszeitraum 15.09.2026 bis 31.01.2027, zu spaet eingereichte Unterlagen werden nicht mehr beruecksichtigt.",
      "event_date_range_text": "27.08.2027 bis 05.09.2027",
      "application_mode": "PDF-Bewerbungsformular zum Download auf michaelismesse.de/bewerbung/ (Einreichungsweg auf der Seite nicht spezifiziert)",
      "postal_address": "Stadt Miltenberg, Engelplatz 69, 63897 Miltenberg",
      "contact_name": "",
      "contact_email": "info@michaelismesse.de",
      "contact_phone": "+49 9371 4040",
      "source_url": "https://michaelismesse.de/bewerbung/",
      "source_domain": "michaelismesse.de",
      "source_kind": "official",
      "last_verified_at": "2026-09-16",
      "agent_batch_id": "by-unterfranken-oberpfalz-2026-09",
      "confidence_status": "partial",
      "notes": "Zwei unterschiedliche Fristen je Kategorie: Vergnuegungspark bereits bis 15.09.2026 (zum Zeitpunkt der Recherche am 16.09.2026 knapp verstrichen), Marktgelaende/Ausstellungshalle/Ausstellungsgelaende bis 31.01.2027. Eintrag bildet die spaetere, noch offene Frist (Marktgelaende) ab. Einreichungsweg (Post/Online) auf der Seite nicht angegeben, Kontaktdaten stammen von der Startseite michaelismesse.de."
    }
  ],
  "rejected_candidates": [],
  "review_candidates": [
    {
      "event_name": "Rakoczy-Fest Bad Kissingen 2027 (Standplaetze Schausteller/Gastronomie)",
      "candidate_url": "https://www.badkissingen.de/kultur/rakoczy-fest",
      "reason": "Groesstes Stadtfest Bad Kissingens, jaehrlich letztes Juli-Wochenende (2026: 24.-26.07.). Keine Unterseite mit Bewerbungsfrist fuer Schausteller/Standbetreiber gefunden. Allgemeiner Kontakt: Stadt Bad Kissingen, Rathausplatz 1, 97688 Bad Kissingen, Tel. 0971/807-0, info@stadt.badkissingen.de. Ticket-/Infohotline: 0971 8048-444, kissingen-ticket@badkissingen.de."
    },
    {
      "event_name": "Kitzinger Fruehlingsfest 2027",
      "candidate_url": "https://www.stadt-kitzingen.de/allgemeines/veranstaltungskalender",
      "reason": "Fruehlingsfest findet auf dem Bleichwasen statt (2026: 04.-12.04., 75. Auflage). Keine offizielle Unterseite mit Bewerbungsfrist fuer Schausteller gefunden. Stadt Kitzingen direkt kontaktieren."
    },
    {
      "event_name": "Volksfest/Markt Hassfurt",
      "candidate_url": "https://hassfurt.de/1.html",
      "reason": "Kein konkretes Volksfest mit Schausteller-Bewerbungsfrist auf offizieller Seite identifiziert. Ordnungsamt Hassfurt: Robert Barth, Marktplatz 1, 97437 Hassfurt, Tel. 09521 688-145, robert.barth@hassfurt.de."
    },
    {
      "event_name": "Schwandorfer Volksfest 2027",
      "candidate_url": "https://www.schwandorf.de/Kultur-Tourismus/Veranstaltungen/Volksfest-Schwandorf/Ausschreibungsunterlagen-Volksfest-Schwandorf-2026-und-2027.php",
      "reason": "Stadt Schwandorf schreibt auf ihrer offiziellen Seite: 'Das 87. Schwandorfer Volksfest ist im Juni 2027 geplant. Sobald genaue Informationen vorliegen, werden diese hier veroeffentlicht.' Ausschreibungsunterlagen fuer 2027 zum Zeitpunkt der Recherche noch nicht online. Allgemeiner Kontakt: info@schwandorf.de, Tel. 09431 45-0."
    },
    {
      "event_name": "Chamer Volksfest 2027",
      "candidate_url": "https://www.cham-volksfest.de/kontakt/",
      "reason": "Veranstalter ist der Verein zur Foerderung oeffentlicher Veranstaltungen und kulturellen Bestrebungen der Stadt Cham e.V. Ansprechpartner fuer Aussteller: Stefan Raab (Platzmeister), Tel. 0160/963 15 959, stefan.raab@stadtwerke-cham.de. Keine Bewerbungsfrist auf der Aussteller-Unterseite gefunden."
    },
    {
      "event_name": "Fruehlingsvolksfest Sulzbach-Rosenberg 2027",
      "candidate_url": "https://www.suro.city/fruehlingsfest-altstadtfest-und-annabergfest-finden-statt/",
      "reason": "Fruehlingsfest 2026 fand 13.-17.05. statt. Standplatzbewerbungen sind schriftlich zu richten an: Amt fuer oeffentliche Sicherheit und Ordnung, Siegfried Lier (Marktmeister), Haus fuer Buergerdienste DG/Zi. 14, Luitpoldplatz 5, 92237 Sulzbach-Rosenberg, Tel. 09661 510-1303, Fax 09661 510-1307, markt@sulzbach-rosenberg.de. Keine konkrete Bewerbungsfrist auf offizieller Seite gefunden."
    },
    {
      "event_name": "Volksfest Tirschenreuth 2027",
      "candidate_url": "https://www.stadt-tirschenreuth.de/leben-in-tirschenreuth/maerkte",
      "reason": "Volksfest am Festplatz Tirschenreuth existiert laut Stadtseite/Veranstaltungshinweisen, aber keine Unterseite mit Bewerbungsfrist fuer Schausteller gefunden. Zustaendig: Buerger- und Ordnungsamt Tirschenreuth, Maximilianplatz 35, 95643 Tirschenreuth, Tel. 09631 609-16, einwohner@stadt-tirschenreuth.de."
    }
  ]
}
