{
  "batch_id": "hamburg-2027-deep-stadt",
  "region_scope": [
    "Freie und Hansestadt Hamburg"
  ],
  "search_terms": [
    "Hamburg Hafengeburtstag 2027 Bewerbung Haendler Gastronomie Schausteller Frist offiziell",
    "hamburg.de Stadtteilfest Volksfest Markt 2027 Bewerbung Schausteller Frist Bezirksamt Sondernutzung",
    "Hamburg Weihnachtsmarkt 2026 Bewerbung Haendler Standbetreiber Frist Bezirksamt offiziell",
    "Hamburg Bezirk Volksfest Spezialmarkt 2027 Ausschreibung Bewerbung Schausteller Frist Altona Wandsbek Harburg",
    "Hamburger DOM 2027 Bewerbungsschluss Nachreichungsfrist Unterlagen"
  ],
  "max_expected_results": 50,
  "source_policy": "official_only",
  "researched_at": "2026-08-03",
  "entries": [
    {
      "id": "hafengeburtstag-hamburg-2027-hamburg",
      "event_name": "838. Hafengeburtstag Hamburg 2027",
      "event_type": "Hafenfest / Volksfest",
      "city": "Hamburg",
      "state": "Hamburg",
      "country": "DE",
      "venue_or_area": "Bunte Hafenmeile, Hamburger Hafen zwischen Landungsbrücken und Baakenhöft",
      "application_deadline_iso": "2026-08-15",
      "application_deadline_text": "Bewerbungsschluss für den HAFENGEBURTSTAG HAMBURG 2027 ist der 15. August 2026; Unterlagen können bis zum 15. Oktober 2026 nachgereicht werden.",
      "event_date_range_text": "6. bis 9. Mai 2027",
      "application_mode": "Online über den HamburgService-Dienst 'Bewerbung für einen Standplatz bei Veranstaltungen'; alternativ per PDF-Formular. Für jedes Geschäft ist eine eigene Bewerbung erforderlich.",
      "postal_address": "Behörde für Wirtschaft, Arbeit und Innovation, Abteilung Hamburger DOM, Hafengeburtstag, bezirkliche Märkte, Alter Steinweg 4, 20459 Hamburg",
      "contact_name": "Steffi Harneit, Ansprechpartnerin für Schausteller und Bunte Hafenmeile",
      "contact_email": "steffi.harneit@bwai.hamburg.de",
      "contact_phone": "+49 40 42841-2626",
      "source_url": "https://www.hamburg.de/freizeit/hafengeburtstag-hamburg/kontaktdaten-346082",
      "source_domain": "hamburg.de",
      "source_kind": "official",
      "last_verified_at": "2026-08-03",
      "agent_batch_id": "hamburg-2027-deep-stadt",
      "confidence_status": "verified",
      "notes": "Rund 450 Aussteller und Standbetreiber auf der Bunten Hafenmeile. Gleicher Bewerbungsschluss wie beim Hamburger DOM 2027, aber getrenntes Verfahren und eigene Ansprechpartnerin. Allgemeine Auskuenfte: hafengeburtstag@bwai.hamburg.de, +49 40 42841 1528."
    },
    {
      "id": "hamburger-dom-2027-hamburg",
      "event_name": "Hamburger DOM 2027",
      "event_type": "Volksfest / DOM",
      "city": "Hamburg",
      "state": "Hamburg",
      "country": "DE",
      "venue_or_area": "Heiligengeistfeld",
      "application_deadline_iso": "2026-08-15",
      "application_deadline_text": "Bewerbungsschluss für das DOM-Jahr 2027 ist der 15. August 2026.",
      "event_date_range_text": "Frühlingsdom: 19.03.-18.04.2027; Sommerdom: 23.07.-29.08.2027; Winterdom: 05.11.-05.12.2027",
      "application_mode": "Online über HamburgService; für jedes Geschäft und jede Veranstaltung ist ein eigenes Formular erforderlich",
      "postal_address": "Behörde für Wirtschaft, Arbeit und Innovation, Alter Steinweg 4, 20459 Hamburg",
      "contact_name": "Carsten Wenzel, Ansprechpartner für Schausteller",
      "contact_email": "hamburger-dom@bwai.hamburg.de",
      "contact_phone": "+49 40 42841-2627",
      "source_url": "https://www.hamburg.de/freizeit/dom/bewerbung-337432",
      "source_domain": "hamburg.de",
      "source_kind": "official",
      "last_verified_at": "2026-08-03",
      "agent_batch_id": "hamburg-2027-deep-stadt",
      "confidence_status": "verified",
      "notes": "Nachreichungsfristen für Unterlagen: Frühlingsdom 2027 bis 15. Oktober 2026, Sommerdom und Winterdom 2027 jeweils bis 15. Februar 2027."
    }
  ],
  "rejected_candidates": [],
  "review_candidates": [
    {
      "event_name": "Hamburger Weihnachtsmarkt auf dem Rathausmarkt",
      "candidate_url": "https://www.hamburger-weihnachtsmarkt.com/faqs/",
      "reason": "Offizielle Veranstalterseite der Roncalli Event GmbH nimmt Bewerbungen ausdruecklich ohne Frist an (maerkte@roncalli.de). Gesucht werden aussergewoehnliche Haendler, Kunsthandwerk und regionale Betriebe, auch wochenweise. Ohne Fristdatum nicht veroeffentlichbar."
    },
    {
      "event_name": "Weihnachtsmarkt Gerhart-Hauptmann-Platz Hamburg-Mitte",
      "candidate_url": "https://bv-hh.de/hamburg-mitte/documents/auswahlverfahren-fuer-die-veranstaltung-weihnachtsmarkt-gerhart-hauptmann-platz-168785",
      "reason": "Das Auswahlverfahren des Bezirksamts Hamburg-Mitte laeuft ueber fuenf Jahre von November 2024 bis Dezember 2028 und richtet sich an Generalunternehmer, nicht an einzelne Beschicker. Die Einreichungsfrist ist in der veroeffentlichten Drucksache nur als Platzhalter 'bis zum XX.XX.202X, 12:00 Uhr' enthalten. Zustaendig: Management des oeffentlichen Raumes, Christin Carstens, 040 42854-2777, Caffamacherreihe 1-3, 20355 Hamburg."
    },
    {
      "event_name": "Bezirkliche Jahrmaerkte Wandsbek (Volksdorf, Bramfeld, Poppenbuettel, Rahlstedt)",
      "candidate_url": "https://www.hamburg.de/politik-und-verwaltung/bezirke/wandsbek/themen/wirtschaft-und-verbraucherschutz/jahrmaerkte-84732",
      "reason": "Das Bezirksamt Wandsbek veroeffentlicht die Jahrmarktstermine 2026 (acht Maerkte von Volksdorf Fruehjahrsmarkt 27.02.-01.03. bis Volksdorf Herbstmarkt 23.-25.10.), nennt aber keine Bewerbungsmodalitaeten und keine Fristen. Kontakt: Verbraucherschutzamt, Markt- und Veranstaltungswesen, Schlossgarten 9, 22041 Hamburg, 040 42881-2889, verbraucherschutzamt@wandsbek.hamburg.de. Termine fuer 2027 liegen noch nicht vor."
    },
    {
      "event_name": "Standplaetze bei Hamburger Volksfesten, Wochen- und Spezialmaerkten (allgemeines Verfahren)",
      "candidate_url": "https://www.hamburg.de/service/info/111110451/",
      "reason": "Die Behoerde fuer Wirtschaft, Arbeit und Innovation nennt als allgemeine Regel 'mindestens 8 Wochen vor Beginn der Veranstaltung' und weist darauf hin, dass fuer einzelne Events laengere Bewerbungszeitraeume gelten. Es handelt sich um eine Fristenregel ohne kalendarisches Datum, daher kein veroeffentlichbarer Eintrag."
    }
  ]
}
