{
  "batch_id": "sn-rp-2027-deep-grossveranstaltungen",
  "region_scope": [
    "Sachsen",
    "Rheinland-Pfalz"
  ],
  "search_terms": [
    "Dresden Striezelmarkt Leipzig Weihnachtsmarkt 2027 Bewerbung Haendler Beschicker Bewerbungsfrist",
    "Dresden Ausschreibung Spezialmaerkte Striezelmarkt 2027 Bewerbung Haendler Frist Amt fuer Wirtschaftsfoerderung",
    "Bad Duerkheim Wurstmarkt Mainz Johannisnacht Koblenz 2027 Bewerbung Schausteller Bewerbungsfrist"
  ],
  "max_expected_results": 40,
  "source_policy": "official_only",
  "researched_at": "2026-08-03",
  "entries": [],
  "rejected_candidates": [
    {
      "event_name": "592. Dresdner Striezelmarkt 2026",
      "candidate_url": "https://www.dresden.de/de/leben/sport-und-freizeit/maerkte/ausschreibungen-maerkte.php",
      "reason": "Die Landeshauptstadt Dresden schrieb 216 Standplaetze in 47 Anbietergruppen aus, Bewerbungsschluss war Donnerstag, 7. Mai 2026. Frist zum Stichtag 03.08.2026 abgelaufen."
    },
    {
      "event_name": "Bad Duerkheimer Stadtfest 2027",
      "candidate_url": "https://www.bad-duerkheim.de/kultur-tourismus/veranstaltungen-feste/bad-duerkheimer-stadtfest/informationen-fuer-beschicker-anwohner/",
      "reason": "Der Bewerbungszeitraum fuer das Stadtfest 2027 lief vom 1. Mai bis 15. Juni 2026; spaeter eingehende Bewerbungen werden laut Stadt nicht mehr beruecksichtigt. Frist zum Stichtag 03.08.2026 abgelaufen."
    }
  ],
  "review_candidates": [
    {
      "event_name": "593. Dresdner Striezelmarkt 2027",
      "candidate_url": "https://www.dresden.de/de/leben/sport-und-freizeit/maerkte/informationen-fuer-haendlerbewerbungen.php",
      "reason": "Aeltester Weihnachtsmarkt Deutschlands mit stark formalisiertem Verfahren. Die Ausschreibung erfolgt jaehrlich Mitte/Ende Maerz bis Mitte April, Bewerbung ueber den Online-Antragsassistenten unter www.dresden.de/maerkte oder per Post. Zustaendig: Amt fuer Wirtschaftsfoerderung, Abt. Kommunale Maerkte, Stefan Heilig, 0351 4888741, markt@dresden.de. Die 2027-Ausschreibung ist zum Pruefzeitpunkt noch nicht eroeffnet. Hohe Prioritaet fuer die Nachfasswelle im Maerz 2027."
    },
    {
      "event_name": "Duerkheimer Wurstmarkt 2027",
      "candidate_url": "https://www.bad-duerkheim.de/kultur-tourismus/veranstaltungen-feste/duerkheimer-wurstmarkt/informationen-fuer-beschicker-anwohner/",
      "reason": "Groesstes Weinfest der Welt. Die Stadt Bad Duerkheim unterhaelt eine eigene Beschickerseite mit Betriebs- und Gestaltungsvorschriften und einem Online-Bewerbungsformular; zugelassen werden nur Beschicker, die den Markt ueber die gesamte Dauer betreiben, Gastronomie nur mit Mehrweggeschirr. Eine kalendarische Bewerbungsfrist fuer 2027 liess sich auf der offiziellen Seite nicht abrufen. Nicht mit dem separaten Bad Duerkheimer Stadtfest verwechseln, das eine eigene Frist hat."
    },
    {
      "event_name": "Leipziger Weihnachtsmarkt 2027",
      "candidate_url": "https://www.leipzig.de/freizeit-kultur-und-tourismus/einkaufen-und-ausgehen/maerkte/leipziger-weihnachtsmarkt/haendler",
      "reason": "Rund 300 Haendler auf einem der groessten Weihnachtsmaerkte Deutschlands. Die staedtische Haendlerseite enthaelt zum Pruefzeitpunkt keine Bewerbungsfrist und keine Kontaktdaten fuer Bewerbungen."
    }
  ]
}
