{
  "batch_id": "he-2027-deep-nord-sued",
  "region_scope": [
    "Nordhessen",
    "Mittelhessen",
    "Rhein-Main",
    "Suedhessen",
    "Osthessen"
  ],
  "search_terms": [
    "Frankfurt Dippemess 2027 Bewerbung Schausteller Bewerbungsfrist Stadt Frankfurt offiziell",
    "Kassel Zissel Weihnachtsmarkt Fruehjahrsmesse 2027 Bewerbung Schausteller Beschicker Frist",
    "Darmstadt Heinerfest Hanau Fulda Marburg 2027 Bewerbung Schausteller Haendler Bewerbungsfrist",
    "Frankfurt Marktamt Dippemess Bewerbung Schausteller Standplatz Bewerbungsfrist frankfurt.de"
  ],
  "max_expected_results": 60,
  "source_policy": "official_only",
  "researched_at": "2026-08-03",
  "entries": [
    {
      "id": "zissel-kassel-2027-kassel",
      "event_name": "Zissel Kassel 2027",
      "event_type": "Volksfest / Stadtfest",
      "city": "Kassel",
      "state": "Hessen",
      "country": "DE",
      "venue_or_area": "Kasseler Innenstadt und Fuldaaue",
      "application_deadline_iso": "2026-12-31",
      "application_deadline_text": "Bewerbungsschluss ist der 31.12. des Vorjahres, für den Zissel 2027 also der 31.12.2026.",
      "event_date_range_text": "Traditionell im Sommer; die genauen Termine 2027 sind noch nicht veröffentlicht.",
      "application_mode": "Bewerbung per Post oder eingescannt per E-Mail an events@kassel-marketing.de.",
      "postal_address": "Kassel Marketing GmbH, Kassel",
      "contact_name": "Kassel Marketing GmbH, Bereich Events",
      "contact_email": "events@kassel-marketing.de",
      "contact_phone": "+49 561 7077-123",
      "source_url": "https://veranstaltungen.kassel-marketing.de/de/bewerbung",
      "source_domain": "veranstaltungen.kassel-marketing.de",
      "source_kind": "official",
      "last_verified_at": "2026-08-03",
      "agent_batch_id": "he-2027-deep-nord-sued",
      "confidence_status": "partial",
      "notes": "Kassel Marketing nennt den Bewerbungsschluss als feste jährliche Regel. Hinweis der Veranstalterin: derzeit sind auf der Website keine Bewerbungsformulare hinterlegt, daher vor Bewerbung Kontakt aufnehmen."
    },
    {
      "id": "altstadtfest-kassel-2027-kassel",
      "event_name": "Altstadtfest Kassel 2027",
      "event_type": "Stadtfest",
      "city": "Kassel",
      "state": "Hessen",
      "country": "DE",
      "venue_or_area": "Kasseler Altstadt",
      "application_deadline_iso": "2026-12-31",
      "application_deadline_text": "Bewerbungsschluss ist der 31.12. des Vorjahres, für das Altstadtfest 2027 also der 31.12.2026.",
      "event_date_range_text": "Die genauen Termine 2027 sind noch nicht veröffentlicht.",
      "application_mode": "Bewerbung per Post oder eingescannt per E-Mail an events@kassel-marketing.de.",
      "postal_address": "Kassel Marketing GmbH, Kassel",
      "contact_name": "Kassel Marketing GmbH, Bereich Events",
      "contact_email": "events@kassel-marketing.de",
      "contact_phone": "+49 561 7077-123",
      "source_url": "https://veranstaltungen.kassel-marketing.de/de/bewerbung",
      "source_domain": "veranstaltungen.kassel-marketing.de",
      "source_kind": "official",
      "last_verified_at": "2026-08-03",
      "agent_batch_id": "he-2027-deep-nord-sued",
      "confidence_status": "partial",
      "notes": "Kassel Marketing nennt den Bewerbungsschluss als feste jährliche Regel. Derzeit sind auf der Website keine Bewerbungsformulare hinterlegt."
    },
    {
      "id": "casseler-fruehlings-freyheit-2027-kassel",
      "event_name": "Casseler Frühlings-Freyheit 2027",
      "event_type": "Frühjahrsvolksfest",
      "city": "Kassel",
      "state": "Hessen",
      "country": "DE",
      "venue_or_area": "Kassel",
      "application_deadline_iso": "2026-12-31",
      "application_deadline_text": "Bewerbungsschluss ist der 31.12. des Vorjahres, für die Casseler Frühlings-Freyheit 2027 also der 31.12.2026.",
      "event_date_range_text": "Die genauen Termine 2027 sind noch nicht veröffentlicht.",
      "application_mode": "Bewerbung per Post oder eingescannt per E-Mail an events@kassel-marketing.de.",
      "postal_address": "Kassel Marketing GmbH, Kassel",
      "contact_name": "Kassel Marketing GmbH, Bereich Events",
      "contact_email": "events@kassel-marketing.de",
      "contact_phone": "+49 561 7077-123",
      "source_url": "https://veranstaltungen.kassel-marketing.de/de/bewerbung",
      "source_domain": "veranstaltungen.kassel-marketing.de",
      "source_kind": "official",
      "last_verified_at": "2026-08-03",
      "agent_batch_id": "he-2027-deep-nord-sued",
      "confidence_status": "partial",
      "notes": "Kassel Marketing nennt den Bewerbungsschluss als feste jährliche Regel. Derzeit sind auf der Website keine Bewerbungsformulare hinterlegt."
    },
    {
      "id": "casseler-herbst-freyheit-2027-kassel",
      "event_name": "Casseler Herbst-Freyheit 2027",
      "event_type": "Herbstvolksfest",
      "city": "Kassel",
      "state": "Hessen",
      "country": "DE",
      "venue_or_area": "Kassel",
      "application_deadline_iso": "2027-01-31",
      "application_deadline_text": "Bewerbungsschluss ist der 31.01. des aktuellen Jahres, für die Casseler Herbst-Freyheit 2027 also der 31.01.2027.",
      "event_date_range_text": "Die genauen Termine 2027 sind noch nicht veröffentlicht.",
      "application_mode": "Bewerbung per Post oder eingescannt per E-Mail an events@kassel-marketing.de.",
      "postal_address": "Kassel Marketing GmbH, Kassel",
      "contact_name": "Kassel Marketing GmbH, Bereich Events",
      "contact_email": "events@kassel-marketing.de",
      "contact_phone": "+49 561 7077-123",
      "source_url": "https://veranstaltungen.kassel-marketing.de/de/bewerbung",
      "source_domain": "veranstaltungen.kassel-marketing.de",
      "source_kind": "official",
      "last_verified_at": "2026-08-03",
      "agent_batch_id": "he-2027-deep-nord-sued",
      "confidence_status": "partial",
      "notes": "Abweichend von den uebrigen Kasseler Veranstaltungen liegt die Frist im Veranstaltungsjahr selbst, nicht im Vorjahr. Derzeit sind auf der Website keine Bewerbungsformulare hinterlegt."
    },
    {
      "id": "maerchenweihnachtsmarkt-2027-kassel",
      "event_name": "Kasseler Märchenweihnachtsmarkt 2027",
      "event_type": "Weihnachtsmarkt",
      "city": "Kassel",
      "state": "Hessen",
      "country": "DE",
      "venue_or_area": "Kasseler Innenstadt",
      "application_deadline_iso": "2027-03-31",
      "application_deadline_text": "Bewerbungsschluss ist der 31.03. des aktuellen Jahres, für den Märchenweihnachtsmarkt 2027 also der 31.03.2027.",
      "event_date_range_text": "Advent 2027; die genauen Termine sind noch nicht veröffentlicht.",
      "application_mode": "Bewerbung per Post oder eingescannt per E-Mail an events@kassel-marketing.de.",
      "postal_address": "Kassel Marketing GmbH, Kassel",
      "contact_name": "Kassel Marketing GmbH, Bereich Events",
      "contact_email": "events@kassel-marketing.de",
      "contact_phone": "+49 561 7077-123",
      "source_url": "https://veranstaltungen.kassel-marketing.de/de/bewerbung",
      "source_domain": "veranstaltungen.kassel-marketing.de",
      "source_kind": "official",
      "last_verified_at": "2026-08-03",
      "agent_batch_id": "he-2027-deep-nord-sued",
      "confidence_status": "partial",
      "notes": "Kassel Marketing nennt den Bewerbungsschluss als feste jährliche Regel. Derzeit sind auf der Website keine Bewerbungsformulare hinterlegt."
    }
  ],
  "rejected_candidates": [
    {
      "event_name": "76. Darmstaedter Heinerfest",
      "candidate_url": "https://www.heinerfest.de/schausteller/keine-laufende-bewerbungsfrist/",
      "reason": "Die offizielle Veranstalterseite vermerkt ausdruecklich: 'Die Bewerbungsfrist fuer das 76. Darmstaedter Heinerfest hat bereits geendet.' Kontakt: Schuchardstrasse 7, 64283 Darmstadt, 06151 296688, info@heinerfest.de."
    }
  ],
  "review_candidates": [
    {
      "event_name": "Darmstaedter Heinerfest 2027",
      "candidate_url": "https://www.heinerfest.de/schausteller/standplaetze-schausteller/",
      "reason": "Groesstes Innenstadtfest Deutschlands, Termin 01.07.-05.07.2027 bestaetigt. Der Veranstalter fuehrt eine eigene Seite 'Keine laufende Bewerbungsfrist' und oeffnet das Verfahren jahrgangsweise; fuer 2027 war zum Pruefzeitpunkt keine Frist eroeffnet. Heimatverein Darmstaedter Heiner e. V., Schuchardstrasse 7, 64283 Darmstadt, 06151 296688 oder 06151 296640, info@heinerfest.de."
    },
    {
      "event_name": "Frankfurter Fruehjahrs-Dippemess 2027",
      "candidate_url": "https://frankfurt.de/frankfurt-entdecken-und-erleben/stadtportrait/frankfurter-feste/fruehjahrs-dippemess",
      "reason": "Groesstes Volksfest Frankfurts auf dem Festplatz am Ratsweg, Termin 19.03.-11.04.2027. Die Vergabe richtet sich nach der staedtischen Vergnuegungsmarktordnung; das offizielle Stadtportal veroeffentlicht jedoch weder Bewerbungsverfahren noch Frist fuer Schausteller. Zustaendig ist das Marktamt der Stadt Frankfurt am Main."
    },
    {
      "event_name": "Frankfurter Herbst-Dippemess 2027",
      "candidate_url": "https://frankfurt.de/frankfurt-entdecken-und-erleben/stadtportrait/frankfurter-feste/herbst-dippemess",
      "reason": "Zweite jaehrliche Ausgabe der Dippemess am Ratsweg. Wie beim Fruehjahrstermin ist auf dem offiziellen Stadtportal kein Bewerbungsverfahren mit kalendarischer Frist veroeffentlicht."
    },
    {
      "event_name": "Bewerbungsformulare Kassel Marketing",
      "candidate_url": "https://veranstaltungen.kassel-marketing.de/de/bewerbung",
      "reason": "Nachfasshinweis zu den fuenf erfassten Kasseler Veranstaltungen: Die Veranstalterin weist darauf hin, dass derzeit keine Bewerbungsformulare auf der Website verfuegbar sind. Vor Ablauf der Fristen pruefen, ob die Formulare eingestellt wurden."
    }
  ]
}
